{
  "id": "base1.fcr",
  "name": [
    {
      "lang": "de",
      "value": "Lösungshäufigkeit"
    },
    {
      "lang": "en",
      "value": "full credit ratio"
    }
  ],
  "description": [
    {
      "lang": "de",
      "value": "Demo Skala vom Typ 'BASE' für Lösungshäufigkeit (Prozent)"
    },
    {
      "lang": "en",
      "value": "Demo scale BASE for full credit ratio"
    }
  ],
  "method": "SCORE_RATIO",
  "methodParameters": {
    "maxValue": 8
  },
  "items": [
    {
      "id": "JU7662804"
    },
    {
      "id": "JU7662801"
    },
    {
      "id": "JU7662802"
    },
    {
      "id": "JU7662803"
    }
  ]
}
